{
  "verificacao": "Divergências RBA x PGDAS-D",
  "funcao": {
  	"nome": "verifica_divergencia_pgdas",
  	"descricao": "Levanta os meses nos quais o relatório do Launchpad \"SN-Receita_Bruta_Declarada_x_Apurada\" apontou divergências, durante o período em que o contribuinte estava no regime do Simples Nacional."
  },
  "notificacao": {
  	"titulo": "OSF <osf> - Divergências PGDAS-D e Receita Bruta Apurada",
  	"corpo": "No âmbito das verificações fiscais da Ordem de Serviço Fiscal <osf>, fica o contribuinte acima identificado NOTIFICADO a prestar informações que esclareçam as divergências identificadas, por meio de cruzamento de dados eletrônicos existentes nos bancos de dados desta Receita Estadual, entre a Receita Bruta Declarada em PGDAS-D n<periodoAAAA> e a Receita Bruta Apurada pelo Fisco, com base nos documentos fiscais eletrônicos emitidos pelo contribuinte, nos termos da planilha juntada.<br><p><b>PRAZO PARA ATENDIMENTO</b>: 10 (dez) dias, contados da ciência da notificação.<br><b>FORMA DE ATENDIMENTO</b>: Envio de declaração firmada por representante legal do contribuinte, digitalizada ou assinada digitalmente, para o endereço eletrônico <email><br><b>BASE LEGAL</b>: Art. 494 do RICMS (Aprovado pelo Decreto 45.490/00).</p>",
  	"anexo": "Divergências PGDAS-D"
  },
  "infracoes": []
}